{
    "id": "automacord.xyz",
    "added": 1535444547,
    "name": "AutomaCord",
    "url": "https://automacord.xyz/",
    "icon": "https://cdn.discordapp.com/icons/483344253963993113/3661052b289c88dfffd5a91080d6beae.png",
    "language": "English",
    "display": 1,
    "defunct": 1,
    "discord_only": 1,
    "description": null,
    "api_docs": null,
    "api_post": null,
    "api_field": null,
    "api_shard_id": null,
    "api_shard_count": null,
    "api_shards": null,
    "api_get": null,
    "api_all": null,
    "view_bot": "https://automacord.xyz/bot/:id",
    "bot_widget": null,
    "content": null,
    "owners": "Kromatic#0420 (180093157554388993)",
    "discord": "https://discord.gg/XQT4DEt",
    "features": [
        "markdown-long-description",
        "custom-bot-invite-link",
        "additional-bot-owners-editors"
    ]
}
