{
    "id": "topcord.xyz",
    "added": 1597352795,
    "name": "TopCord",
    "url": "https://topcord.xyz/",
    "icon": "https://topcord.xyz/logo.png",
    "language": "English",
    "display": 1,
    "defunct": 0,
    "discord_only": 0,
    "description": "TopCord is the best Discord Bot List for finding the Discord bots that suit your server.",
    "api_docs": "https://docs.topcord.xyz/#/",
    "api_post": "https://api.topcord.xyz/bot/:id/stats",
    "api_field": "guilds",
    "api_shard_id": null,
    "api_shard_count": "shards",
    "api_shards": null,
    "api_get": "https://api.topcord.xyz/bot/:id",
    "api_all": "https://api.topcord.xyz/bots",
    "view_bot": "https://topcord.xyz/bot/:id",
    "bot_widget": "https://topcord.xyz/widget/bot/:id",
    "content": null,
    "owners": "ElectricReality#2009 (319680837320704003)",
    "discord": "https://discord.gg/zira",
    "features": [
        "bot-resubmission",
        "has-ads-on-site",
        "html-long-description",
        "iframe-long-description",
        "markdown-long-description",
        "certified-bot-vanity-urls",
        "custom-bot-support-link",
        "custom-bot-website-link",
        "discord-bot-support-link",
        "has-voting",
        "votes-sent-to-webhooks",
        "voting-data-exposed",
        "has-categories-or-tags",
        "has-mobile-support",
        "has-search",
        "has-widget",
        "requires-owner-in-server",
        "server-count-api"
    ]
}
