{
    "id": "discordboats.club",
    "added": 1533208489,
    "name": "Discord Boats",
    "url": "https://discordboats.club/",
    "icon": "https://cdn.discordapp.com/icons/421630709585805312/15fa554458a690010d7575fbd02839a7.png",
    "language": "English",
    "display": 1,
    "defunct": 1,
    "discord_only": 1,
    "description": null,
    "api_docs": null,
    "api_post": "https://discordboats.club/api/public/bot/stats",
    "api_field": "server_count",
    "api_shard_id": null,
    "api_shard_count": null,
    "api_shards": null,
    "api_get": null,
    "api_all": null,
    "view_bot": "https://discordboats.club/bot/:id",
    "bot_widget": "https://discordboats.club/bot/:id/widget.png",
    "content": "After inactivity and a long period of no development, the list was sold to MrSheldon and merged into discord.boats.",
    "owners": "Anthony#3912 (233823931830632449)",
    "discord": "https://discord.gg/qRarbNz",
    "features": [
        "markdown-long-description",
        "custom-bot-github-link",
        "custom-bot-invite-link",
        "custom-bot-website-link",
        "vanity-urls-for-all",
        "voting-data-exposed",
        "has-mobile-support"
    ]
}
