{
    "id": "bots.ondiscord.xyz",
    "added": 1532965633,
    "name": "Bots on Discord",
    "url": "https://bots.ondiscord.xyz/",
    "icon": "https://cdn.discordapp.com/icons/446425626988249089/c9599b1e0fdb902b81d93468ada512cf.png",
    "language": "English",
    "display": 1,
    "defunct": 0,
    "discord_only": 1,
    "description": "Easily find and share Discord bots",
    "api_docs": "https://bots.ondiscord.xyz/info/api",
    "api_post": "https://bots.ondiscord.xyz/bot-api/bots/:id/guilds",
    "api_field": "guildCount",
    "api_shard_id": null,
    "api_shard_count": null,
    "api_shards": null,
    "api_get": null,
    "api_all": null,
    "view_bot": "https://bots.ondiscord.xyz/bots/:id",
    "bot_widget": "https://bots.ondiscord.xyz/bots/:id/embed",
    "content": null,
    "owners": "Brussell#0660 (95286900801146880)",
    "discord": "https://discord.gg/bvm6vSv",
    "features": [
        "bot-resubmission",
        "markdown-long-description",
        "custom-bot-invite-link",
        "custom-bot-website-link",
        "discord-bot-support-link",
        "additional-bot-owners-editors",
        "has-categories-or-tags",
        "has-mobile-support"
    ]
}
