{
    "id": "discordbots.group",
    "added": 1532965633,
    "name": "Discord Bots Group",
    "url": "https://discordbots.group/",
    "icon": "https://cdn.discordapp.com/icons/447469952044105728/b725a3f9bf422b18480d3a9f829be06a.png",
    "language": "English",
    "display": 1,
    "defunct": 1,
    "discord_only": 1,
    "description": null,
    "api_docs": "https://docs.discordbots.group/",
    "api_post": "https://api.discordbots.group/v1/bot/:id",
    "api_field": "server_count",
    "api_shard_id": null,
    "api_shard_count": null,
    "api_shards": "shards",
    "api_get": "https://api.discordbots.group/v1/bot/:id",
    "api_all": null,
    "view_bot": "https://discordbots.group/bot/:id",
    "bot_widget": null,
    "content": null,
    "owners": "DetectiveHuman#1234 (449653897695461376)",
    "discord": "https://discord.gg/9jJtKRc",
    "features": [
        "markdown-long-description",
        "custom-bot-github-link",
        "custom-bot-invite-link",
        "custom-bot-support-link",
        "custom-bot-website-link",
        "discord-bot-support-link",
        "voting-data-exposed",
        "additional-bot-owners-editors",
        "has-categories-or-tags",
        "has-mobile-support"
    ]
}
