{
    "id": "boatlist.ml",
    "added": 1533208489,
    "name": "Boat List",
    "url": "https://boatlist.ml/",
    "icon": "https://cdn.discordapp.com/icons/425727209873997845/93665eebf1ef572917ec0e4c66be88ad.png",
    "language": "English",
    "display": 1,
    "defunct": 1,
    "discord_only": 1,
    "description": null,
    "api_docs": null,
    "api_post": "https://boatlist.ml/api/bots/:id/stats",
    "api_field": "server_count",
    "api_shard_id": null,
    "api_shard_count": null,
    "api_shards": null,
    "api_get": null,
    "api_all": null,
    "view_bot": null,
    "bot_widget": null,
    "content": "This list has shut down and has been replaced by a newer version under different management: https://botblock.org/lists/boatlist.xyz",
    "owners": "Kolkies#9876 (209609796704403456)",
    "discord": "https://discord.gg/SHEtT3x",
    "features": [
        "custom-bot-github-link"
    ]
}
