{
    "id": "space-bot-list.xyz",
    "added": 1581887063,
    "name": "Space Bots List",
    "url": "https://space-bot-list.xyz/",
    "icon": "https://cdn.discordapp.com/attachments/595675239480950807/717039409916280863/SBL_new.png",
    "language": "English",
    "display": 1,
    "defunct": 0,
    "discord_only": 1,
    "description": "Space Bots List is botlist that you can find most of good bots, and learn from here how to make bot, with helpful staff",
    "api_docs": "https://spacebots.gitbook.io/tutorial-en/api/stats",
    "api_post": "https://space-bot-list.xyz/api/bots/:id",
    "api_field": "guilds",
    "api_shard_id": null,
    "api_shard_count": null,
    "api_shards": null,
    "api_get": "https://space-bot-list.xyz/api/bots/:id",
    "api_all": null,
    "view_bot": "https://space-bot-list.xyz/bots/:id",
    "bot_widget": null,
    "content": null,
    "owners": "MR.Nak#9011 (471973265594908673), Derpy#6666 (388320576407863297)",
    "discord": "https://discord.gg/jkwDfC7",
    "features": [
        "markdown-long-description",
        "custom-bot-github-link",
        "custom-bot-support-link",
        "custom-bot-website-link",
        "voting-data-exposed",
        "additional-bot-owners-editors",
        "has-mobile-support",
        "requires-owner-in-server"
    ]
}
