{
    "id": "boatspace.xyz",
    "added": 1620045793,
    "name": "BoatSpace",
    "url": "https://boatspace.xyz/",
    "icon": "https://boatspace.xyz/cdn/img/boat.png",
    "language": "English",
    "display": 1,
    "defunct": 0,
    "discord_only": 1,
    "description": "The best bot list on the internet! BoatSpace enables users to find the best bot for their Discord server fast, easily, and for free!",
    "api_docs": "https://docs.boatspace.xyz/",
    "api_post": "https://boatspace.xyz/api/bots/:id",
    "api_field": "server_count",
    "api_shard_id": null,
    "api_shard_count": "shard_count",
    "api_shards": null,
    "api_get": "https://boatspace.xyz/api/bots/:id",
    "api_all": null,
    "view_bot": null,
    "bot_widget": "https://boatspace.xyz/api/bots/:id/widget?type=png",
    "content": null,
    "owners": "HGDev#9997 (242734840829575169)",
    "discord": "https://discord.gg/bVakMZY",
    "features": [
        "has-ads-on-site",
        "html-long-description",
        "markdown-long-description",
        "certified-bot-vanity-urls",
        "custom-bot-support-link",
        "custom-bot-website-link",
        "has-voting",
        "has-certification-program",
        "has-mobile-support"
    ]
}
