{
    "id": "bhbotlist.tech",
    "added": 1658768359,
    "name": "BHbotlist",
    "url": "https://bhbotlist.tech/",
    "icon": "https://cdn.discordapp.com/attachments/671391805715120148/1001172244707410010/logo.png",
    "language": "English",
    "display": 1,
    "defunct": 0,
    "discord_only": 1,
    "description": "Spice up your Discord experience with our diverse range of Discord bots",
    "api_docs": "https://docs.bhbotlist.tech/",
    "api_post": "https://bhbotlist.tech/api/bot/:id",
    "api_field": "server_count",
    "api_shard_id": null,
    "api_shard_count": "shard_count",
    "api_shards": null,
    "api_get": "https://bhbotlist.tech/api/bot/:id",
    "api_all": null,
    "view_bot": "https://bhbotlist.tech/bot/:id",
    "bot_widget": "https://bhbotlist.tech/bot/:id/embed",
    "content": null,
    "owners": "{Ansh}#0607 (671390595184459782), Blacky#9125 (959276033683628122)",
    "discord": "https://discord.gg/xtx49HtRMb",
    "features": [
        "bot-resubmission",
        "offers-paid-promotion",
        "unique bots",
        "html-long-description",
        "certified-bot-vanity-urls",
        "custom-bot-github-link",
        "custom-bot-invite-link",
        "custom-bot-support-link",
        "custom-bot-website-link",
        "discord-bot-support-link",
        "has-voting",
        "has-categories-or-tags",
        "has-search",
        "server-count-api"
    ]
}
