{
    "id": "discord.rovelstars.com",
    "added": 1639455345,
    "name": "Rovel Discord List",
    "url": "https://discord.rovelstars.com",
    "icon": "https://discord.rovelstars.com/assets/img/bot/logo.svg",
    "language": "English",
    "display": 1,
    "defunct": 0,
    "discord_only": 1,
    "description": "Imagine a place - where you get to find everything about discord! Ranging from bots, to users, servers, templates, banners, stickers and emojis!",
    "api_docs": null,
    "api_post": "https://discord.rovelstars.com/api/bots/:id/servers",
    "api_field": "count",
    "api_shard_id": null,
    "api_shard_count": null,
    "api_shards": null,
    "api_get": "https://discord.rovelstars.com/api/v1/bots/:id",
    "api_all": "https://discord.rovelstars.com/api/v1/bots",
    "view_bot": "https://discord.rovelstars.com/bots/:id",
    "bot_widget": null,
    "content": null,
    "owners": "Ren Hiyama#1800 (889439979686739998)",
    "discord": "https://dscrdly.com/server",
    "features": [
        "site-internationalisation-support",
        "iframe-long-description",
        "custom-bot-github-link",
        "discord-bot-support-link",
        "has-voting",
        "voting-data-exposed",
        "has-mobile-support",
        "server-count-api",
        "html-long-description",
        "markdown-long-description",
        "html-long-description",
        "markdown-long-description",
        "custom-bot-donate-link",
        "custom-bot-invite-link",
        "custom-bot-website-link",
        "vanity-urls-for-all",
        "votes-sent-to-webhooks",
        "additional-bot-owners-editors",
        "has-search",
        "requires-owner-in-server"
    ]
}
