{
    "id": "fateslist.xyz",
    "added": 1613320331,
    "name": "Fates List",
    "url": "https://fateslist.xyz/",
    "icon": "https://api.fateslist.xyz/static/botlisticon.webp",
    "language": "English",
    "display": 1,
    "defunct": 1,
    "discord_only": 1,
    "description": "Find the best bots for your servers.",
    "api_docs": "https://docs.fateslist.xyz",
    "api_post": "https://api.fateslist.xyz/api/v2/bots/:id/stats",
    "api_field": "guild_count",
    "api_shard_id": null,
    "api_shard_count": "shard_count",
    "api_shards": "shards",
    "api_get": "https://api.fateslist.xyz/api/v2/bots/:id",
    "api_all": null,
    "view_bot": "https://fateslist.xyz/bot/:id",
    "bot_widget": "https://api.fateslist.xyz/api/v2/bots/:id/widget",
    "content": null,
    "owners": "Rootspring#6701 (563808552288780322), skylarr#6666 (790722073248661525), Builderb#0001 (190590364871032834)",
    "discord": "https://discord.gg/69Thz4teWm",
    "features": [
        "bot-resubmission",
        "bot-reviews",
        "html-long-description",
        "markdown-long-description",
        "custom-bot-github-link",
        "custom-bot-invite-link",
        "custom-bot-website-link",
        "discord-bot-support-link",
        "vanity-urls-for-all",
        "has-voting",
        "votes-sent-to-webhooks",
        "voting-data-exposed",
        "additional-bot-owners-editors",
        "has-categories-or-tags",
        "has-certification-program",
        "has-mobile-support",
        "has-search",
        "has-widget",
        "server-count-api"
    ]
}
