{
    "id": "discordservices.net",
    "added": 1620045981,
    "name": "Discord Services",
    "url": "https://discordservices.net/",
    "icon": "https://discordservices.net/icon.png",
    "language": "English",
    "display": 1,
    "defunct": 0,
    "discord_only": 1,
    "description": "A brand new botlist that aims to deliver the best experience for its users and bot developers with unique features and tools.",
    "api_docs": "https://discordservices.net/docs/api",
    "api_post": "https://api.discordservices.net/bot/:id/stats",
    "api_field": "servers",
    "api_shard_id": null,
    "api_shard_count": "shards",
    "api_shards": null,
    "api_get": null,
    "api_all": null,
    "view_bot": "https://discordservices.net/bot/:id",
    "bot_widget": null,
    "content": null,
    "owners": "Builderb#0001 (190590364871032834)",
    "discord": "https://discord.gg/2JVesec7kM",
    "features": [
        "bot-resubmission",
        "markdown-long-description",
        "custom-bot-donate-link",
        "custom-bot-github-link",
        "custom-bot-invite-link",
        "custom-bot-support-link",
        "custom-bot-website-link",
        "discord-bot-support-link",
        "vanity-urls-for-all",
        "has-voting",
        "votes-sent-to-webhooks",
        "additional-bot-owners-editors",
        "has-categories-or-tags",
        "has-certification-program",
        "has-search",
        "has-widget",
        "server-count-api"
    ]
}
