{
    "id": "discordbots.co",
    "added": 1592468403,
    "name": "Discord Bots",
    "url": "https://discordbots.co",
    "icon": "https://discordbots.co/favicon.png",
    "language": "English",
    "display": 1,
    "defunct": 0,
    "discord_only": 1,
    "description": "A new well-developed bot list from Vultrex Development. Here you can advertise your bot for free! ",
    "api_docs": "https://discordbots.co/api",
    "api_post": "https://api.discordbots.co/v1/public/bot/:id/stats",
    "api_field": "serverCount",
    "api_shard_id": null,
    "api_shard_count": "shardCount",
    "api_shards": null,
    "api_get": "https://api.discordbots.co/v1/public/bot/:id",
    "api_all": null,
    "view_bot": "https://discordbots.co/bot/:id",
    "bot_widget": null,
    "content": null,
    "owners": "Missy#0001 (157206689836171264)",
    "discord": "https://discord.gg/WeftAFp",
    "features": [
        "bot-resubmission",
        "bot-reviews",
        "html-long-description",
        "markdown-long-description",
        "custom-bot-donate-link",
        "custom-bot-github-link",
        "custom-bot-invite-link",
        "custom-bot-website-link",
        "discord-bot-support-link",
        "vanity-urls-for-all",
        "has-voting",
        "votes-sent-to-webhooks",
        "voting-data-exposed",
        "additional-bot-owners-editors",
        "has-categories-or-tags",
        "has-mobile-support",
        "has-search",
        "has-widget",
        "server-count-api"
    ]
}
