{
    "id": "botlists.com",
    "added": 1606421098,
    "name": "Astro Bot List",
    "url": "https://botlists.com/",
    "icon": "https://cdn.bot-list.xyz/7364djcas.png",
    "language": "English",
    "display": 1,
    "defunct": 1,
    "discord_only": 1,
    "description": "Astro bot list, just another discord bot lists where you show off your bots you made!",
    "api_docs": "https://botlists.com/api/docs",
    "api_post": "https://botlists.com/api/bot",
    "api_field": "guild_count",
    "api_shard_id": null,
    "api_shard_count": "shard_count",
    "api_shards": null,
    "api_get": "https://botlists.com/api/bot",
    "api_all": null,
    "view_bot": "https://botlists.com/bot/:id",
    "bot_widget": "https://botlists.com/bot/:id/widget",
    "content": "Website is not responding.",
    "owners": "QGV#2101 (185957154606284800)",
    "discord": "https://botlists.com/discord",
    "features": [
        "offers-paid-promotion",
        "bot-internationalisation-support",
        "html-long-description",
        "iframe-long-description",
        "markdown-long-description",
        "custom-bot-github-link",
        "custom-bot-support-link",
        "has-voting",
        "votes-sent-to-webhooks",
        "additional-bot-owners-editors",
        "has-categories-or-tags",
        "has-mobile-support",
        "has-search",
        "requires-owner-in-server",
        "server-count-api"
    ]
}
