{
    "id": "discord.services",
    "added": 1532965633,
    "name": "Discord Services",
    "url": "https://discord.services/",
    "icon": "https://cdn.discordapp.com/icons/294505571317710849/a17f3c3ac54d09c04ab6c4f2f5dc9c12.png",
    "language": "English",
    "display": 1,
    "defunct": 1,
    "discord_only": 1,
    "description": null,
    "api_docs": "https://discord.services/api/",
    "api_post": "https://discord.services/api/bots/:id",
    "api_field": "server_count",
    "api_shard_id": null,
    "api_shard_count": null,
    "api_shards": null,
    "api_get": "https://discord.services/api/bots/:id",
    "api_all": "https://discord.services/api/bots",
    "view_bot": null,
    "bot_widget": null,
    "content": null,
    "owners": "Jazzibell#0069 (209219778206760961)",
    "discord": "https://discord.gg/hc6Wane",
    "features": [
        "custom-bot-invite-link"
    ]
}
