{
    "id": "bots.idledev.org",
    "added": 1554996077,
    "name": "Idle Bot List",
    "url": "https://bots.idledev.org/",
    "icon": "https://cdn.discordapp.com/icons/521461252317249537/d3834340a5a6c466c1ac52d5aaf63fd0.png",
    "language": "English",
    "display": 1,
    "defunct": 1,
    "discord_only": 1,
    "description": null,
    "api_docs": null,
    "api_post": "https://bots.idledev.org/api/bot/:id/stats",
    "api_field": "server_count",
    "api_shard_id": null,
    "api_shard_count": null,
    "api_shards": null,
    "api_get": "https://bots.idledev.org/api/bot/:id/info",
    "api_all": null,
    "view_bot": "https://bots.idledev.org/bot/:id",
    "bot_widget": null,
    "content": null,
    "owners": "Tea Cup#9999 (338192747754160138)",
    "discord": "https://discord.gg/wU7B46S",
    "features": [
        "bot-resubmission",
        "bot-reviews",
        "html-long-description",
        "markdown-long-description",
        "has-voting",
        "additional-bot-owners-editors",
        "has-categories-or-tags",
        "has-search"
    ]
}
