{
    "id": "discords.com",
    "added": 1532965633,
    "name": "Bots for Discord",
    "url": "https://discords.com/bots/",
    "icon": "https://cdn.discordapp.com/icons/374071874222686211/2fec188b91ebe43605065ee66a4df815.png",
    "language": "English",
    "display": 1,
    "defunct": 0,
    "discord_only": 1,
    "description": null,
    "api_docs": "https://docs.botsfordiscord.com",
    "api_post": "https://botsfordiscord.com/api/bot/:id",
    "api_field": "server_count",
    "api_shard_id": null,
    "api_shard_count": null,
    "api_shards": null,
    "api_get": "https://botsfordiscord.com/api/bot/:id",
    "api_all": null,
    "view_bot": "https://botsfordiscord.com/bots/:id",
    "bot_widget": "https://botsfordiscord.com/api/bot/:id/widget",
    "content": null,
    "owners": "Henry#1234 (165939947457478656)",
    "discord": "https://discord.gg/j5SRg4d",
    "features": [
        "bot-resubmission",
        "html-long-description",
        "markdown-long-description",
        "custom-bot-github-link",
        "custom-bot-invite-link",
        "custom-bot-support-link",
        "custom-bot-website-link",
        "discord-bot-support-link",
        "has-voting",
        "votes-sent-to-webhooks",
        "voting-data-exposed",
        "additional-bot-owners-editors",
        "has-categories-or-tags",
        "has-mobile-support",
        "has-search",
        "server-count-api"
    ]
}
