{
    "id": "bladebotlist.xyz",
    "added": 1581889191,
    "name": "BladeBotList",
    "url": "https://bladebotlist.xyz/",
    "icon": "https://cdn.discordapp.com/icons/645281161949741064/fad8d2e250d653f180a547f728273f5a.png",
    "language": "English",
    "display": 1,
    "defunct": 0,
    "discord_only": 1,
    "description": "Discover a lot of new Discord bots for free and without login ! we check your bot in less than 12h* ",
    "api_docs": null,
    "api_post": "https://bladebotlist.xyz/api/bots/:id/stats",
    "api_field": "server_count",
    "api_shard_id": null,
    "api_shard_count": "shard_count",
    "api_shards": null,
    "api_get": "https://bladebotlist.xyz/api/bots/:id",
    "api_all": null,
    "view_bot": "https://bladebotlist.xyz/bot/:id",
    "bot_widget": "https://bladebotlist.xyz/bot/:id/widget.png",
    "content": null,
    "owners": "HiiZun#0001 (355995885085392896)",
    "discord": "https://discord.gg/pQc6ZRH",
    "features": [
        "bot-resubmission",
        "offers-paid-promotion",
        "markdown-long-description",
        "certified-bot-vanity-urls",
        "custom-bot-github-link",
        "custom-bot-invite-link",
        "custom-bot-support-link",
        "custom-bot-website-link",
        "discord-bot-support-link",
        "has-voting",
        "votes-sent-to-webhooks",
        "has-categories-or-tags",
        "has-mobile-support",
        "has-search",
        "server-count-api"
    ]
}
